{
  "window_id": "wk_2026_10",
  "account_outcomes": [
    {
      "account_id": "acct_123",
      "potential_outcomes": {
        "human_touch": {
          "meeting_prob": 0.30,
          "opp_prob": 0.12,
          "pipeline_value": 40000
        },
        "automated_outbound": {
          "meeting_prob": 0.10,
          "opp_prob": 0.03,
          "pipeline_value": 7000
        },
        "nurture": {
          "meeting_prob": 0.06,
          "opp_prob": 0.02,
          "pipeline_value": 4000
        },
        "recycle": {
          "meeting_prob": 0.03,
          "opp_prob": 0.01,
          "pipeline_value": 1000
        },
        "disqualify": {
          "meeting_prob": 0.00,
          "opp_prob": 0.00,
          "pipeline_value": 0
        },
        "wait": {
          "meeting_prob": 0.04,
          "opp_prob": 0.01,
          "pipeline_value": 2000
        }
      }
    },
    {
      "account_id": "acct_456",
      "potential_outcomes": {
        "human_touch": {
          "meeting_prob": 0.14,
          "opp_prob": 0.05,
          "pipeline_value": 16000
        },
        "automated_outbound": {
          "meeting_prob": 0.11,
          "opp_prob": 0.04,
          "pipeline_value": 12000
        },
        "nurture": {
          "meeting_prob": 0.07,
          "opp_prob": 0.02,
          "pipeline_value": 6000
        },
        "recycle": {
          "meeting_prob": 0.04,
          "opp_prob": 0.01,
          "pipeline_value": 1500
        },
        "disqualify": {
          "meeting_prob": 0.00,
          "opp_prob": 0.00,
          "pipeline_value": 0
        },
        "wait": {
          "meeting_prob": 0.08,
          "opp_prob": 0.03,
          "pipeline_value": 9000
        }
      }
    }
  ],
  "contact_outcomes": [
    {
      "account_id": "acct_123",
      "default_contact_id": "ct_4",
      "contacts": [
        {
          "contact_id": "ct_1",
          "meeting_gain": 0.18,
          "opp_gain": 0.07,
          "pipeline_gain": 22000
        },
        {
          "contact_id": "ct_2",
          "meeting_gain": 0.14,
          "opp_gain": 0.05,
          "pipeline_gain": 17000
        },
        {
          "contact_id": "ct_4",
          "meeting_gain": 0.05,
          "opp_gain": 0.01,
          "pipeline_gain": 3000
        }
      ]
    },
    {
      "account_id": "acct_456",
      "default_contact_id": "ct_3",
      "contacts": [
        {
          "contact_id": "ct_3",
          "meeting_gain": 0.06,
          "opp_gain": 0.02,
          "pipeline_gain": 5000
        }
      ]
    }
  ],
  "trigger_outcomes": [
    {
      "account_id": "acct_123",
      "triggers": [
        {
          "event_id": "evt_1",
          "relevance_gain": 1.0
        },
        {
          "event_id": "evt_3",
          "relevance_gain": 0.72
        }
      ]
    },
    {
      "account_id": "acct_456",
      "triggers": [
        {
          "event_id": "evt_2",
          "relevance_gain": 0.84
        },
        {
          "event_id": "evt_4",
          "relevance_gain": 0.51
        }
      ]
    }
  ]
}
